,regions,law_schools,theology_schools,exegetical_interests,periods,date,author_name,author_id,tafsir_name,tafsir_id
0,Iran (East),Shafiʿi,"Sunni, undefined",,"early, post-Buyid; Mamluk",1075,Abū 'l-Ḥasan ʿAlī ibn Aḥmad al-Wāḥidī,80,al-Waǧīz fī tafsīr al-kitāb al-ʿazīz,60
1,Iraq,Ibadi,Athariyya,,colonial,1854,Abū 'ṯ-Ṯanāʾ Šihāb ad-Dīn Maḥmūd ibn ʿAlī al-Alūsī al-Ḥasanī al-Ḥusaynī al-Baġdādī,4,Rūḥ al-maʿānī: fī tafsīr al-Qurʿān al-ʿaẓīm wa-s-sabʿ al-maṯānī,52
2,Egypt,Sunni,"Sunni, undefined",,post-colonial,2000,Laǧnat al-Qurʾān wa-s-Sunna fī Maǧlis al-Aʿlā li-š-Šuʾūn al-Islāmiyya,38,al-Muntaḫab fī tafsīr al-Qurʾān al-Karīm,65
3,Khwarazm,Sunni,Muʿtazila,,pre-Mongolian,1144,Maḥmūd ibn ʿUmar az-Zamaḫšarī,81,al-Kaššāf ʿan ḥaqāʾiq ġawāmiḍ at-tanzīl wa-ʿuyūn al-aqāwīl fī wuǧūh at-taʾwīl,2
4,Algeria,Ibadi,Ibadi,,colonial,1914,Muḥammad ibn Yūsuf Aṭfayyiš,8,Himyān az-zād ilā dār al-maʿād,49
5,Algeria,Ibadi,Ibadi,,colonial,1914,Muḥammad ibn Yūsuf Aṭfayyiš,8,Taysīr at-tafsīr li-l-qurʾān al-karīm,50
6,Iran (West),Jaʿfari,Tasawwuf,,colonial,1909,Sulṭān Muḥammad al-Ǧunābaḏī,18,Tafsīr Bayān as-saʿāda fī maqāmāt al-ʿibāda,42
