,regions,law_schools,theology_schools,exegetical_interests,periods,date,author_name,author_id,tafsir_name,tafsir_id,sc_id
0,Greater Syria,Sunni,"Sunni, undefined",,post-colonial,2021,Muḥammad ʿAlī aṣ-Ṣābūnī,55,Ṣawfat at-tafāsīr: tafsīr li-l-Qurʾān al-karīm,83,sc.83_37_114_182
1,Arabian Peninsula,Sunni,"Sunni, undefined",,post-colonial,1973,Muḥammad al-Amīn ibn Muḥammad al-Muḫtār ibn ʿAbd al-Qādir al-Ǧakanī aš-Šanqīṭī,61,Aḍwāʾ al-bayān fī īḍāḥ al-Qurʾān bi-l-Qurʾān,54,sc.54_37_22_26
2,Iran (East),Sunni,Tasawwuf,,post-Mongolian,1328,Nizām ad-Dīn al-Ḥasan ibn Muḥammad an-Nīsābūrī,47,Ġarāʾib al-Qurʾān wa-raġāʾib al-furqān,22,sc.22_37_1_82
3,"Andalus, al-",Sunni,"Sunni, undefined",,"Andalusian; early, post-Buyid",1009,Muḥammad ibn ʿAbdallāh ibn Abī Zamanīn,25,Tafsīr al-Qurʾān al-ʿazīz,104,sc.104_37_22_50
4,Iraq,Sunni,Tasawwuf,,post-Mongolian,1166,ʿAbd al-Qādir ibn Abū Ṣālīḥ al-Ǧīlānī,17,Tafsīr al-Ǧīlānī,95,sc.95_37_22_33
5,Iran (East),Shafiʿi,"Sunni, undefined",,"early, post-Buyid; Mamluk",1035,Aḥmad ibn Muḥammad Abū Isḥāq aṯ-Ṯaʿlabī,75,al-Kašf wa-l-bayān fī tafsīr al-Qurʾān,75,sc.75_37_1_23
6,Iraq,Jaʿfari,Twelver Shiʿa,,"early, pre-Buyid",900,Abū 'l-Qāsim Furāt ibn Ibrāhīm ibn Furāt al-Kūfī,15,Tafsīr Furāt al-Kūfī,48,sc.48_37_15_23
7,Iraq,Sunni,Ashʿariyya,,pre-Mongolian,1200,ʿAbd ar-Raḥmān ibn ʿAlī ibn al-Ǧawzī,28,Zād al-masīr fī ʿilm at-tafsīr,15,sc.15_37_11_26
8,Egypt,Sunni,"Sunni, undefined",,18th century,1826,Aḥmad ibn Muḥammad aṣ-Ṣāwī,63,Ḥāšīyat aṣ-Ṣāwī ʿalā tafsīr al-Ǧalālayn,96,sc.96_37_19_28
9,Iran (East); Iraq,Sunni,"Sunni, undefined",,early,767,Muqātil ibn Sulaymān al-Balḫī,44,Tafsīr Muqātil ibn Sulaymān,67,sc.67_37_21_30
10,Iran (West),Sunni,Ashʿariyya; Muʿtazila,,Abbasid,1058,ʿAlī ibn Muḥammad al-Māwardī,42,an-Nukat wa-l-ʿuyūn,12,sc.12_37_20_26
11,Iran (East),Shafiʿi,"Sunni, undefined",,"early, post-Buyid; Mamluk",1075,Abū 'l-Ḥasan ʿAlī ibn Aḥmad al-Wāḥidī,80,al-Waǧīz fī tafsīr al-kitāb al-ʿazīz,60,sc.60_37_18_29
12,Arabian Peninsula; Iraq,Maliki,"Sunni, undefined",,"Abbasid; early, post-Buyid",1045,Makkī ibn Abū Ṭālib al-Qaysī,40,al-Hidāya ilā bulūġ an-nihāya,92,sc.92_37_13_44
13,Iran (West),Sunni,"Sunni, undefined",,"early, post-Buyid",971,Sulaymān ibn Aḥmad aṭ-Ṭabarānī,71,Tafsīr al-Qurʾān al-karīm,91,sc.91_37_22_26
14,"Andalus, al-; Egypt",Sunni,"Sunni, undefined",,Andalusian,1345,Aṯīr ad-Dīn Abū Ḥayyān Muḥammad ibn Yūsuf ibn ʿAlī ibn Ḥayyān al-Andalūsī,2,al-Baḥr al-muḥīṭ,19,sc.19_37_22_39
15,Arabian Peninsula,Hanbali,"Sunni, undefined",,colonial,1957,ʿAbd ar-Raḥmān ibn Nāṣir as-Saʿdī,58,Taysīr al-karīm ar-raḥmān fī tafsīr kalām al-mannān,98,sc.98_37_22_26
16,Iraq,Ibadi,Athariyya,,colonial,1854,Abū 'ṯ-Ṯanāʾ Šihāb ad-Dīn Maḥmūd ibn ʿAlī al-Alūsī al-Ḥasanī al-Ḥusaynī al-Baġdādī,4,Rūḥ al-maʿānī: fī tafsīr al-Qurʿān al-ʿaẓīm wa-s-sabʿ al-maṯānī,52,sc.52_37_23_23
17,Iran (East),Sunni; Zaydi; other law school,"Sunni, undefined",,18th century; pre-Mongolian,1220,Naǧm ad-Dīn Aḥmad ibn ʿUmar al-Kubrā,3,at-Taʾwīlāt an-naǧmiyya fī at-tafsīr al-ʾišārī aṣ-ṣūfī,97,sc.97_37_13_24
18,Iran (East),Hanafi,Maturidiyya,,"early, post-Buyid",985,Abū 'l-Layṯ as-Samarqandī,59,Baḥr al-ʿulūm,11,sc.11_37_19_40
19,Iraq,Sunni,Athariyya,,Abbasid,923,Muḥammad ibn Ǧarīr aṭ-Ṭabarī,72,Ǧāmiʿ al-bayān ʿan taʾwīl āy al-Qurʾān,1,sc.1_37_22_23
20,Iran (West),Jaʿfari,Twelver Shiʿa,,post-colonial,1981,Muḥammad Ḥusayn aṭ-Ṭabāṭabāʾī,74,al-Mīzān fī tafsīr al-Qurʾān,56,sc.56_37_12_70
21,Egypt,Sunni,Ashʿariyya,,Mamluk,1505,Ǧalāl ad-Dīn ʿAbd ar-Raḥmān Ibn Abī Bakr as-Suyūṭī,68,ad-Durr al-manṯūr fī at-tafsīr bi-l-maʾṯūr,26,sc.26_37_22_23
22,Yemen,Sunni,"Sunni, undefined",,post-Mongolian,1414,Muḥammad ibn Yaʿqūb al-Fīrūzābādī,14,Tafsīr al-Qurʾān,10,sc.10_37_22_45
23,Yemen,Sunni,Athariyya,,18th century,1834,Muḥammad ibn ʿAlī ibn Muḥammad aš-Šawkānī,64,Fatḥ al-qadīr,9,sc.9_37_20_49
24,Morocco,Sunni,Tasawwuf,,18th century,1809,Aḥmad ibn Muḥammad ibn ʿAǧība,27,al-Baḥr al-madīd fī tafsīr al-Qurʾān al-maǧīd,37,sc.37_37_22_34
25,Greater Syria,Sunni,"Sunni, undefined",,Mamluk,1476,Abū Ḥafṣ ʿUmar ibn ʿAlī ibn ʿĀdil al-Dimašqī Nuʿmānī,26,al-Lubāb fī ʿulūm al-kitāb,24,sc.24_37_19_26
26,"Andalus, al-",Sunni,Ashʿariyya,,Andalusian,1273,Muḥammad ibn Aḥmad al-Qurṭubī,51,al-Ǧāmiʿ li-aḥkām al-Qurʾān,5,sc.5_37_22_35
27,Iran (West),Jaʿfari,Twelver Shiʿa,,pre-Mongolian,1153,al-Faḍl ibn al-Ḥasan aṭ-Ṭabarsī,73,Maǧmaʿ al-bayān fī tafsīr al-Qurʾān,3,sc.3_37_21_30
28,Egypt,Sunni,"Sunni, undefined",,post-colonial,2000,Laǧnat al-Qurʾān wa-s-Sunna fī Maǧlis al-Aʿlā li-š-Šuʾūn al-Islāmiyya,38,al-Muntaḫab fī tafsīr al-Qurʾān al-Karīm,65,sc.65_37_21_30
29,Iran (East),Shafiʿi,"Sunni, undefined",,pre-Mongolian,1122,al-Ḥusayn ibn Masʿūd al-Baġawī,10,Maʿālim at-tanzīl,13,sc.13_37_16_24
30,Iran (West),Sunni,Ashʿariyya,,post-Mongolian,1319,ʿAbdallāh ibn ʿUmar al-Bayḍāwī,12,Anwār at-tanzīl wa-asrār at-taʾwīl,6,sc.6_37_11_23
31,Iran (West),Hanafi,Maturidiyya,,post-Mongolian,1311,Ḥāfiẓ ad-Dīn Abū l-Barakāt ʿAbdallāh ibn Aḥmad an-Nasafī,45,Madārik at-tanzīl wa-ḥaqāʾiq at-taʾwīl,17,sc.17_37_1_28
32,Greater Syria,Sunni,Athariyya,,Mamluk,1373,Ismāʿīl ibn ʿUmar ibn Kaṯīr,34,Tafsīr al-Qurʾān al-ʿaẓīm,7,sc.7_37_20_26
33,Arabian Peninsula; Greater Syria,Sunni,"Sunni, undefined",,early; pre-Mongolian,1151,ʿAbd al-Ḥaqq ibn Ġālib ibn ʿAṭiyya,32,al-Muḥarrar al-waǧīz fī tafsīr al-kitāb al-ʿazīz,14,sc.14_37_19_26
34,Greater Syria,Sunni,"Sunni, undefined",,post-colonial,2021,Muḥammad ʿAlī aṣ-Ṣābūnī,55,Ṣawfat at-tafāsīr: tafsīr li-l-Qurʾān al-karīm,83,sc.83_37_1_61
35,Khwarazm,Sunni,Muʿtazila,,pre-Mongolian,1144,Maḥmūd ibn ʿUmar az-Zamaḫšarī,81,al-Kaššāf ʿan ḥaqāʾiq ġawāmiḍ at-tanzīl wa-ʿuyūn al-aqāwīl fī wuǧūh at-taʾwīl,2,sc.2_37_22_26
36,Iran (East),Sunni,Ashʿariyya; Tasawwuf,,pre-Mongolian,1072,ʿAbd al-Karīm ibn Hawāzin al-Qušayrī,52,Laṭāʾif al-išārāt bi-tafsīr al-Qurʾān,31,sc.31_37_22_27
37,Anatolia,Sunni,Maturidiyya,,Ottoman,1574,Abū 's-Suʿūd Muḥammad ibn Muḥammad al-ʿImādī,1,Iršād al-ʿaql as-salīm ilā mazāyā al-kitāb al-karīm,28,sc.28_37_23_28
38,Algeria,Ibadi,Ibadi,,colonial,1914,Muḥammad ibn Yūsuf Aṭfayyiš,8,Himyān az-zād ilā dār al-maʿād,49,sc.49_37_22_23
39,Iran (West),Jaʿfari,Twelver Shiʿa,,pre-Mongolian,1067,Muḥammad ibn Ḥasan aṭ-Ṭūsī,78,at-Tibyān fī tafsīr al-Qurʾān,39,sc.39_37_21_30
40,Egypt,Sunni,"Sunni, undefined",,post-colonial,2010,Muḥammad Sayyid aṭ-Ṭanṭāwī,76,at-Tafsīr al-wasīṭ li-l-Qurʾān al-Karīm,57,sc.57_37_22_39
41,Egypt,Sunni,"Sunni, undefined",,post-colonial,1998,Muḥammad Mutawallī aš-Šaʿrāwī,62,Ḫawāṭir Muḥammad Mutawallī aš-Šaʿrawī,76,sc.76_37_22_24
42,Yemen,Maliki,Zaydiyya,,Ottoman,1695,Aḥmad ʿAlī Muḥammad ʿAlī al-Aʿqam al-Ānisī,6,Tafsīr al-Aʿqam,47,sc.47_37_11_32
43,Algeria,Ibadi,Ibadi,,colonial,1914,Muḥammad ibn Yūsuf Aṭfayyiš,8,Taysīr at-tafsīr li-l-qurʾān al-karīm,50,sc.50_37_22_23
44,Anatolia,Ibadi,Maturidiyya,,Ottoman,1725,Ismāʿīl Ḥaqqī al-Bursawī,35,Rūḥ al-bayān fī tafsīr al-Qurʾān,36,sc.36_37_21_23
45,Iran (West),Sunni,Tasawwuf,,pre-Mongolian,1210,Rūzbihān al-Baqlī aš-Šīrāzī,11,ʿArāʾis al-bayān fī ḥaqāʾiq al-Qurʾān,4,sc.4_37_22_26
46,Greater Syria,Shafiʿi,"Sunni, undefined",,Mamluk,1341,ʿAlī ibn Muḥammad ibn al-Ḫāzin aš-Šiḥi,20,Lubāb at-taʾwīl fī maʿānī at-tanzīl,18,sc.18_37_20_26
47,Algeria,Sunni,"Sunni, undefined",,post-colonial,2018,Abū Bakr Ǧābir ibn Mūsā ibn ʿAbd al-Qādir al-Ǧazāʾirī,16,Aysar at-tafāsīr li-kalām al-ʿalī al-kabīr,66,sc.66_37_22_30
48,Jordan ,Sunni,"Sunni, undefined",,post-colonial,1984,Ibrāhīm al-Qaṭṭān,49,Taysīr at-tafsīr,68,sc.68_37_11_26
49,"Andalus, al-; Egypt",Sunni,"Sunni, undefined",,Andalusian,1345,Aṯīr ad-Dīn Abū Ḥayyān Muḥammad ibn Yūsuf ibn ʿAlī ibn Ḥayyān al-Andalūsī,2,an-Nahr al-mādd min al-baḥr al-muḥīṭ,90,sc.90_37_1_34
50,Tunisia,Sunni,Ashʿariyya,,colonial,1973,Muḥammad aṭ-Ṭāhir ibn ʿAšūr,31,at-Taḥrīr wa-t-tanwīr,55,sc.55_37_22_23
51,Greater Syria,Sunni,"Sunni, undefined",,post-colonial,2021,Muḥammad ʿAlī aṣ-Ṣābūnī,55,Muḫtaṣar tafsīr Ibn Kaṯīr,84,sc.84_37_20_26
52,Transoxania,Sunni,Maturidiyya,,"early, pre-Buyid",944,Abū Manṣūr Muḥammad ibn Muḥammad ibn Maḥmūd as-Samarqandī al-Māturīdī,41,Taʾwīlāt ahl as-sunna,94,sc.94_37_11_26
53,Iran (West),Jaʿfari,Twelver Shiʿa,,Safavid,1680,Mullā Muḥammad ibn Murtaḍā ibn Maḥmūd al-Kašānī,36,aṣ-Ṣāfī fī tafsīr kalām Allāh al-wāfī,41,sc.41_37_17_37
54,Iran (West),Jaʿfari,Tasawwuf,,colonial,1909,Sulṭān Muḥammad al-Ǧunābaḏī,18,Tafsīr Bayān as-saʿāda fī maqāmāt al-ʿibāda,42,sc.42_37_22_23
55,"Andalus, al-; Egypt",Sunni,"Sunni, undefined",,Andalusian,1345,Aṯīr ad-Dīn Abū Ḥayyān Muḥammad ibn Yūsuf ibn ʿAlī ibn Ḥayyān al-Andalūsī,2,an-Nahr al-mādd min al-baḥr al-muḥīṭ,90,sc.90_15_26_87
56,Iraq,Sunni,Ashʿariyya,,pre-Mongolian,1200,ʿAbd ar-Raḥmān ibn ʿAlī ibn al-Ǧawzī,28,Zād al-masīr fī ʿilm at-tafsīr,15,sc.15_15_30_41
