,regions,law_schools,theology_schools,exegetical_interests,periods,date,author_name,author_id,tafsir_name,tafsir_id,sc_id
0,Iraq,Ibadi,Athariyya,,colonial,1854,Abū 'ṯ-Ṯanāʾ Šihāb ad-Dīn Maḥmūd ibn ʿAlī al-Alūsī al-Ḥasanī al-Ḥusaynī al-Baġdādī,4,Rūḥ al-maʿānī: fī tafsīr al-Qurʿān al-ʿaẓīm wa-s-sabʿ al-maṯānī,52,sc.52_19_43_43
1,Egypt,Sunni,"Sunni, undefined",,Mamluk,1505,Ǧalāl ad-Dīn Muḥammad ibn Aḥmad al-Maḥallī,39,Tafsīr al-Ǧalālayn,8,sc.8_19_43_43
2,Greater Syria,Sunni,"Sunni, undefined",,colonial,1914,Ǧamāl ad-Dīn Muḥammad al-Qāsimī,48,Maḥāsin at-Taʾwīl,102,sc.102_19_43_43
3,Iran (East),Sunni,Ashʿariyya; Tasawwuf,,pre-Mongolian,1072,ʿAbd al-Karīm ibn Hawāzin al-Qušayrī,52,Laṭāʾif al-išārāt bi-tafsīr al-Qurʾān,31,sc.31_19_43_43
4,Iran (West),Jaʿfari,Tasawwuf,,colonial,1909,Sulṭān Muḥammad al-Ǧunābaḏī,18,Tafsīr Bayān as-saʿāda fī maqāmāt al-ʿibāda,42,sc.42_19_43_43
5,Greater Syria,Sunni,"Sunni, undefined",,post-colonial,2022,Asʿad Maḥmūd Ḥawmad,7,"Aysar at-tafāsīr: tafsīr, asbāb nuzūl, aḥādīṯ, namāḏiǧ iʿrāb",71,sc.71_19_43_43
6,Iran (West),Sunni,"Sunni, undefined",,"early, post-Buyid",971,Sulaymān ibn Aḥmad aṭ-Ṭabarānī,71,Tafsīr al-Qurʾān al-karīm,91,sc.91_19_43_43
7,Iraq,Sunni,Athariyya,,Abbasid,923,Muḥammad ibn Ǧarīr aṭ-Ṭabarī,72,Ǧāmiʿ al-bayān ʿan taʾwīl āy al-Qurʾān,1,sc.1_19_43_43
8,Anatolia,Ibadi,Maturidiyya,,Ottoman,1725,Ismāʿīl Ḥaqqī al-Bursawī,35,Rūḥ al-bayān fī tafsīr al-Qurʾān,36,sc.36_19_43_43
