,regions,law_schools,theology_schools,exegetical_interests,periods,date,author_name,author_id,tafsir_name,tafsir_id
0,['Greater Syria'],['Sunni'],"['Sunni, undefined']",,['colonial'],1914,Ǧamāl ad-Dīn Muḥammad al-Qāsimī,48,Maḥāsin at-Taʾwīl,102
1,"['Andalus, al-', 'Greater Syria']",['Zaydi'],"['Sunni, undefined']",,['Andalusian'],1240,Muhyī ad-Dīn ibn ʿArabī,29,Tafsīr al-Qurʾān al-karīm,33
2,['Transoxania'],['Sunni'],['Maturidiyya'],,"['early, pre-Buyid']",944,Abū Manṣūr Muḥammad ibn Muḥammad ibn Maḥmūd as-Samarqandī al-Māturīdī,41,Taʾwīlāt ahl as-sunna,94
3,['Iran (East)'],['Sunni'],"['Ashʿariyya', 'Tasawwuf']",,['pre-Mongolian'],1072,ʿAbd al-Karīm ibn Hawāzin al-Qušayrī,52,Laṭāʾif al-išārāt bi-tafsīr al-Qurʾān,31
4,['Algeria'],['Sunni'],"['Sunni, undefined']",,['post-colonial'],2018,Abū Bakr Ǧābir ibn Mūsā ibn ʿAbd al-Qādir al-Ǧazāʾirī,16,Aysar at-tafāsīr li-kalām al-ʿalī al-kabīr,66
5,['Anatolia'],['Ibadi'],['Maturidiyya'],,['Ottoman'],1725,Ismāʿīl Ḥaqqī al-Bursawī,35,Rūḥ al-bayān fī tafsīr al-Qurʾān,36
