,regions,law_schools,theology_schools,exegetical_interests,periods,date,author_name,author_id,tafsir_name,tafsir_id
0,Greater Syria,Sunni,Athariyya,,Mamluk,1373,Ismāʿīl ibn ʿUmar ibn Kaṯīr,34,Tafsīr al-Qurʾān al-ʿaẓīm,7
1,"Andalus, al-",Sunni,Ashʿariyya,,Andalusian,1340,Muḥammad ibn Ahmad ibn Ǧuzayy al-Ġarnāṭī,33,Kitāb at-Tašīl li-ʿulūm at-tanzīl,88
2,Algeria,Sunni,"Sunni, undefined",,post-colonial,2018,Abū Bakr Ǧābir ibn Mūsā ibn ʿAbd al-Qādir al-Ǧazāʾirī,16,Aysar at-tafāsīr li-kalām al-ʿalī al-kabīr,66
3,Transoxania,Sunni,Maturidiyya,,"early, pre-Buyid",944,Abū Manṣūr Muḥammad ibn Muḥammad ibn Maḥmūd as-Samarqandī al-Māturīdī,41,Taʾwīlāt ahl as-sunna,94
4,Egypt,Sunni,"Sunni, undefined",,post-colonial,2010,Muḥammad Sayyid aṭ-Ṭanṭāwī,76,at-Tafsīr al-wasīṭ li-l-Qurʾān al-Karīm,57
5,"Andalus, al-",Sunni,Ashʿariyya,,Andalusian,1273,Muḥammad ibn Aḥmad al-Qurṭubī,51,al-Ǧāmiʿ li-aḥkām al-Qurʾān,5
6,Iran (West),Hanafi,Maturidiyya,,post-Mongolian,1311,Ḥāfiẓ ad-Dīn Abū l-Barakāt ʿAbdallāh ibn Aḥmad an-Nasafī,45,Madārik at-tanzīl wa-ḥaqāʾiq at-taʾwīl,17
7,Greater Syria,Sunni,"Sunni, undefined",,colonial,1914,Ǧamāl ad-Dīn Muḥammad al-Qāsimī,48,Maḥāsin at-Taʾwīl,102
8,Anatolia,Sunni,Maturidiyya,,Ottoman,1574,Abū 's-Suʿūd Muḥammad ibn Muḥammad al-ʿImādī,1,Iršād al-ʿaql as-salīm ilā mazāyā al-kitāb al-karīm,28
9,"Andalus, al-; Egypt",Sunni,"Sunni, undefined",,Andalusian,1345,Aṯīr ad-Dīn Abū Ḥayyān Muḥammad ibn Yūsuf ibn ʿAlī ibn Ḥayyān al-Andalūsī,2,al-Baḥr al-muḥīṭ,19
10,Iran (East); Iraq,Sunni,"Sunni, undefined",,early,767,Muqātil ibn Sulaymān al-Balḫī,44,Tafsīr Muqātil ibn Sulaymān,67
11,Iran (East),Shafiʿi,"Sunni, undefined",,"early, post-Buyid; Mamluk",1075,Abū 'l-Ḥasan ʿAlī ibn Aḥmad al-Wāḥidī,80,al-Waǧīz fī tafsīr al-kitāb al-ʿazīz,60
12,Iran (East),Sunni; Zaydi; other law school,"Sunni, undefined",,18th century; pre-Mongolian,1220,Naǧm ad-Dīn Aḥmad ibn ʿUmar al-Kubrā,3,at-Taʾwīlāt an-naǧmiyya fī at-tafsīr al-ʾišārī aṣ-ṣūfī,97
13,Iraq,Sunni,Tasawwuf,,post-Mongolian,1166,ʿAbd al-Qādir ibn Abū Ṣālīḥ al-Ǧīlānī,17,Tafsīr al-Ǧīlānī,95
14,Egypt,Sunni,"Sunni, undefined",,post-colonial,2000,Laǧnat al-Qurʾān wa-s-Sunna fī Maǧlis al-Aʿlā li-š-Šuʾūn al-Islāmiyya,38,al-Muntaḫab fī tafsīr al-Qurʾān al-Karīm,65
15,Jordan ,Sunni,"Sunni, undefined",,post-colonial,1984,Ibrāhīm al-Qaṭṭān,49,Taysīr at-tafsīr,68
16,Iran (West),Jaʿfari,Twelver Shiʿa,,pre-Mongolian,1067,Muḥammad ibn Ḥasan aṭ-Ṭūsī,78,at-Tibyān fī tafsīr al-Qurʾān,39
17,Egypt,Sunni,Ashʿariyya,,Mamluk,1505,Ǧalāl ad-Dīn ʿAbd ar-Raḥmān Ibn Abī Bakr as-Suyūṭī,68,ad-Durr al-manṯūr fī at-tafsīr bi-l-maʾṯūr,26
18,Greater Syria,Sunni,"Sunni, undefined",,post-colonial,2021,Muḥammad ʿAlī aṣ-Ṣābūnī,55,Muḫtaṣar tafsīr Ibn Kaṯīr,84
19,Iran (East),Hanafi,Maturidiyya,,"early, post-Buyid",985,Abū 'l-Layṯ as-Samarqandī,59,Baḥr al-ʿulūm,11
20,Iran (East),Shafiʿi,"Sunni, undefined",,"early, post-Buyid; Mamluk",1035,Aḥmad ibn Muḥammad Abū Isḥāq aṯ-Ṯaʿlabī,75,al-Kašf wa-l-bayān fī tafsīr al-Qurʾān,75
21,Yemen,Sunni,"Sunni, undefined",,post-Mongolian,1414,Muḥammad ibn Yaʿqūb al-Fīrūzābādī,14,Tafsīr al-Qurʾān,10
22,"Andalus, al-",Sunni,"Sunni, undefined",,"Andalusian; early, post-Buyid",1009,Muḥammad ibn ʿAbdallāh ibn Abī Zamanīn,25,Tafsīr al-Qurʾān al-ʿazīz,104
23,Iran (West),Jaʿfari,Twelver Shiʿa,,post-colonial,1981,Muḥammad Ḥusayn aṭ-Ṭabāṭabāʾī,74,al-Mīzān fī tafsīr al-Qurʾān,56
24,"Andalus, al-; Greater Syria",Zaydi,"Sunni, undefined",,Andalusian,1240,Muhyī ad-Dīn ibn ʿArabī,29,Tafsīr al-Qurʾān al-karīm,33
25,Greater Syria,Sunni,"Sunni, undefined",,Mamluk,1480,Burḥān ad-Dīn Abū al-Ḥasan Ibrāhīm ibn ʿUmar al-Biqāʿī,13,Naẓm ad-durar fī tanāsub al-ayāt wa-s-suwar,25
26,Greater Syria,Sunni,"Sunni, undefined",,post-colonial,2021,Muḥammad ʿAlī aṣ-Ṣābūnī,55,Ṣawfat at-tafāsīr: tafsīr li-l-Qurʾān al-karīm,83
27,Iran (East),Sunni,Tasawwuf,,post-Mongolian,1328,Nizām ad-Dīn al-Ḥasan ibn Muḥammad an-Nīsābūrī,47,Ġarāʾib al-Qurʾān wa-raġāʾib al-furqān,22
28,Morocco,Sunni,Tasawwuf,,18th century,1809,Aḥmad ibn Muḥammad ibn ʿAǧība,27,al-Baḥr al-madīd fī tafsīr al-Qurʾān al-maǧīd,37
29,Yemen,Sunni,Athariyya,,18th century,1834,Muḥammad ibn ʿAlī ibn Muḥammad aš-Šawkānī,64,Fatḥ al-qadīr,9
30,Greater Syria,Shafiʿi,"Sunni, undefined",,Mamluk,1341,ʿAlī ibn Muḥammad ibn al-Ḫāzin aš-Šiḥi,20,Lubāb at-taʾwīl fī maʿānī at-tanzīl,18
31,Iran (West),Jaʿfari,Twelver Shiʿa,,Safavid,1680,Mullā Muḥammad ibn Murtaḍā ibn Maḥmūd al-Kašānī,36,aṣ-Ṣāfī fī tafsīr kalām Allāh al-wāfī,41
