,regions,law_schools,theology_schools,exegetical_interests,periods,date,author_name,author_id,tafsir_name,tafsir_id
0,Khwarazm,Sunni,Muʿtazila,,pre-Mongolian,1144,Maḥmūd ibn ʿUmar az-Zamaḫšarī,81,al-Kaššāf ʿan ḥaqāʾiq ġawāmiḍ at-tanzīl wa-ʿuyūn al-aqāwīl fī wuǧūh at-taʾwīl,2
1,Iran (West),Sunni,Ashʿariyya,,post-Mongolian,1319,ʿAbdallāh ibn ʿUmar al-Bayḍāwī,12,Anwār at-tanzīl wa-asrār at-taʾwīl,6
2,Anatolia,Ibadi,Maturidiyya,,Ottoman,1725,Ismāʿīl Ḥaqqī al-Bursawī,35,Rūḥ al-bayān fī tafsīr al-Qurʾān,36
3,Egypt,Sunni,"Sunni, undefined",,Mamluk,1505,Ǧalāl ad-Dīn Muḥammad ibn Aḥmad al-Maḥallī,39,Tafsīr al-Ǧalālayn,8
4,Algeria,Ibadi,Ibadi,,colonial,1914,Muḥammad ibn Yūsuf Aṭfayyiš,8,Taysīr at-tafsīr li-l-qurʾān al-karīm,50
5,Iran (West),Jaʿfari,Tasawwuf,,colonial,1909,Sulṭān Muḥammad al-Ǧunābaḏī,18,Tafsīr Bayān as-saʿāda fī maqāmāt al-ʿibāda,42
6,Algeria,Ibadi,Ibadi,,colonial,1914,Muḥammad ibn Yūsuf Aṭfayyiš,8,Himyān az-zād ilā dār al-maʿād,49
7,Iran (West),Sunni,"Sunni, undefined",,"early, post-Buyid",971,Sulaymān ibn Aḥmad aṭ-Ṭabarānī,71,Tafsīr al-Qurʾān al-karīm,91
