,regions,law_schools,theology_schools,exegetical_interests,periods,date,author_name,author_id,tafsir_name,tafsir_id,sc_id
0,Tunisia,Sunni,Ashʿariyya,,colonial,1973,Muḥammad aṭ-Ṭāhir ibn ʿAšūr,31,at-Taḥrīr wa-t-tanwīr,55,sc.55_20_135_135
1,Khwarazm,Sunni,Muʿtazila,,pre-Mongolian,1144,Maḥmūd ibn ʿUmar az-Zamaḫšarī,81,al-Kaššāf ʿan ḥaqāʾiq ġawāmiḍ at-tanzīl wa-ʿuyūn al-aqāwīl fī wuǧūh at-taʾwīl,2,sc.2_20_135_135
2,Egypt,Sunni,"Sunni, undefined",,post-colonial,1998,Muḥammad Mutawallī aš-Šaʿrāwī,62,Ḫawāṭir Muḥammad Mutawallī aš-Šaʿrawī,76,sc.76_20_135_135
3,Algeria,Ibadi,Ibadi,,colonial,1914,Muḥammad ibn Yūsuf Aṭfayyiš,8,Himyān az-zād ilā dār al-maʿād,49,sc.49_20_135_135
4,Anatolia,Sunni,Maturidiyya,,Ottoman,1574,Abū 's-Suʿūd Muḥammad ibn Muḥammad al-ʿImādī,1,Iršād al-ʿaql as-salīm ilā mazāyā al-kitāb al-karīm,28,sc.28_20_135_135
