,regions,law_schools,theology_schools,exegetical_interests,periods,date,author_name,author_id,tafsir_name,tafsir_id,sc_id
0,Iraq,Ibadi,Athariyya,,colonial,1854,Abū 'ṯ-Ṯanāʾ Šihāb ad-Dīn Maḥmūd ibn ʿAlī al-Alūsī al-Ḥasanī al-Ḥusaynī al-Baġdādī,4,Rūḥ al-maʿānī: fī tafsīr al-Qurʿān al-ʿaẓīm wa-s-sabʿ al-maṯānī,52,sc.52_37_23_23
1,Iraq,Sunni,Athariyya,,Abbasid,923,Muḥammad ibn Ǧarīr aṭ-Ṭabarī,72,Ǧāmiʿ al-bayān ʿan taʾwīl āy al-Qurʾān,1,sc.1_37_22_23
2,Egypt,Sunni,"Sunni, undefined",,post-colonial,2000,Laǧnat al-Qurʾān wa-s-Sunna fī Maǧlis al-Aʿlā li-š-Šuʾūn al-Islāmiyya,38,al-Muntaḫab fī tafsīr al-Qurʾān al-Karīm,65,sc.65_37_21_30
3,Algeria,Ibadi,Ibadi,,colonial,1914,Muḥammad ibn Yūsuf Aṭfayyiš,8,Himyān az-zād ilā dār al-maʿād,49,sc.49_37_22_23
4,Algeria,Ibadi,Ibadi,,colonial,1914,Muḥammad ibn Yūsuf Aṭfayyiš,8,Taysīr at-tafsīr li-l-qurʾān al-karīm,50,sc.50_37_22_23
5,Iran (West),Sunni,Tasawwuf,,pre-Mongolian,1210,Rūzbihān al-Baqlī aš-Šīrāzī,11,ʿArāʾis al-bayān fī ḥaqāʾiq al-Qurʾān,4,sc.4_37_22_26
6,Tunisia,Sunni,Ashʿariyya,,colonial,1973,Muḥammad aṭ-Ṭāhir ibn ʿAšūr,31,at-Taḥrīr wa-t-tanwīr,55,sc.55_37_22_23
